|business_id|review_id|user_id|city|name|longitude|latitude|postal_code|text
719|n7V4cD-KqqE3OXk0irJTyA|ZoehS8I1xpJBXyDWvYsgAg|TuoqT1x5SY6RvJ4LLGCKmQ|Las Vegas|GameWorks|-115.1788768|36.0682585154|89119|"If you're not into the whole bar scene or looking for a way to kill time in Town Square then check this place out. This new location is much smaller than the previous one located on the strip, however, you can still find something that everyone will like. The main gaming area has games that I haven't seen in any other Las Vegas arcades including ticket, shooter, driving, 4D, old school and Japanese games. They even have Purikura inside! There is a section for PC and console games as well as a section for bowling. The bar area is a good size with plenty of seating inside and outside of the store. The seats also aren't located next to the games so it's nice not having people constantly walk around you while you eat (unlike Dave and Buster's).The only downside is that these games are expensive because you pay with ""points."" I suggest buying the package deal where you have unlimited play for 1 hour. We were offered this deal when a friend bought a drink at the bar so I'm not sure if a drink purchase is required."
720|n7V4cD-KqqE3OXk0irJTyA|RZ9DZOHKWRFaDIKz4eVeRA|zTkrX8zWAGj1aCOFj2MOyQ|Las Vegas|GameWorks|-115.1788768|36.0682585154|89119|This was the latest of several trips here with our 3 boys while visiting Vegas. Again it was great entertainment for the kids. However I was frustrated by the many machines that were not working at all or in desperate need of repair. I was recently at a Dave and Busters where the games were newer and in better shape. Still a nice off Strip option for kids, but I hope the games are updated and repaired soon.
721|n7V4cD-KqqE3OXk0irJTyA|4ROxqcJmZq--yZ2_CstRWg|UKs_HPSFrYbRvhJ2pTKKrA|Las Vegas|GameWorks|-115.1788768|36.0682585154|89119|This place is fun, I got a great deal on Groupon and was like heck yeah I'm 30 and I don't care if I'm seen playing them arcade games all day for free lol!!! I like the environment. I bought me one of my hometowns IPA beers which is 10 barrel at the bar there. Had a great time with family and friends.
722|n7V4cD-KqqE3OXk0irJTyA|CsAXVif3-iHngSJw8RIY2A|3lTlgrNb-BcjrQrzQv2sDw|Las Vegas|GameWorks|-115.1788768|36.0682585154|89119|Fun! The Thai Chicken Sandwich is really good. They have some old school games that brought back fun memories
723|n7V4cD-KqqE3OXk0irJTyA|cw5N1nsmbMbjcIbJknSukA|86pNYOl58dZCq32KL-XBjA|Las Vegas|GameWorks|-115.1788768|36.0682585154|89119|E-sports section of Gameworks  is the real gem. I bring my son all the time and every  employee that works there is awesome! They have a great selection of games and stay up to date. Also, if you ever get hungry or thirsty you can order from the menu while you play. Can't beat that.
724|n7V4cD-KqqE3OXk0irJTyA|8hePFglhJ2G7lHEYN8zCSA|ytVf6Ar_QwqFiL08plIfOQ|Las Vegas|GameWorks|-115.1788768|36.0682585154|89119|This place is pretty awesome. Somewhere all age groups can go and have fun. There's arcade games,  bowling, pool, large tv's for sports, a bar, food; with all of that you're going to be entertained at some point. It's just like Dave and Buster's if you know what that is, but maybe a little better. I would definitely come back, and also suggest that you try it, cool place to hang out and there's so many other things within walking distance of this place(food,  bars, clubs, shopping, movie theater).
725|n7V4cD-KqqE3OXk0irJTyA|2fFOzNmx4fYdiRfYnYZjDg|VYUf1IDtk5NWb5J7xsJqkA|Las Vegas|GameWorks|-115.1788768|36.0682585154|89119|Went to go see the hateful 8 at AMC and it was sold out...so my GF and I decided to stop at GameWorks after some post Xmas shopping. As an esports fan, I had to see that area. It's pretty cool to see GW recognize how big the esports industry really is. Upon entering, I was impressed by the variety, design and vibe of the esports area. I was greeted by Carlos, the manager, who told me that Alex and V (can't remember her full name) would take good care of us. They had amazing service and as we were playing Halo 5 I noticed V handle a group of loitering obnoxious teens (I rarely use this word, I'm still a big kid) like a pro. They made sure we were taken good care of. Well done everyone, will be back for sure. Very happy with my time spent there tonight.
726|n7V4cD-KqqE3OXk0irJTyA|vvAjk2y2IlrjKaX9QJ959w|SFb7FLvZGRaJ3bbFQRDBbQ|Las Vegas|GameWorks|-115.1788768|36.0682585154|89119|"Honestly every time I go here the games are always broken and take my credits. It makes me sad. I also feel that the games take way too many credits to play especially for them to be broken. I always think ""hey lets go to gameworks"" and then I realize how bad it is everytime hahaha. Granted I hate chuck e cheese but it's way better as far as games go it also feels more liberating with actual tickets in your hand. I do prefer the people at gameworks VS chuck e cheese because it's flooded with little kids. Anyways Gameworks is ok... I guess lol"
727|n7V4cD-KqqE3OXk0irJTyA|ApdQX274L5hfwzaJqvd46g|cnyCyr5az4YzlQ1oCSYNvQ|Las Vegas|GameWorks|-115.1788768|36.0682585154|89119|We got the unlimitepd card and the kids loved it! We spent all day in here.  Gives my AC a rest lol.  Its a nice family spot.  A lot of (pre)teenagers hang out too without supervision but they all seemed well behaved.
728|n7V4cD-KqqE3OXk0irJTyA|o3Cp-ixF_abFj7tVO1AsIg|cglyQq_IWXEuAFKXYhNXgg|Las Vegas|GameWorks|-115.1788768|36.0682585154|89119|"I'm not a ""gamer"", but I do enjoy a fun atmosphere, drinking yummy cocktails, and trying new things which is exactly what GameWorks in Town Square offered. Being new to Vegas, I wasn't familiar with GameWorks prior to my visit there or what to expect from it; I was pleasantly surprised with all they had to offer. The facility itself is HUGE! There are tons and tons of games to play, my favorite was the frog log jump and the Terminator one!! They also have ski ball and a basket ball shooting game. For those of you faithful gamers they even have an entire room set up for online/computer games where you can play til your hearts content while sipping cocktails. My favorite part is their full bowling lanes!! When you're ready to wet your whistle they also have a large full bar with a full menu. My visit happened to be their second day of being open, so their food was still needing some tweaking, however everything I ate did have great flavor. I am definitely looking forward to giving their menu another try."
729|n7V4cD-KqqE3OXk0irJTyA|wHWCaELw8abRCAqNem-VyQ|kkCUBM9m2gGyBfN5neE84g|Las Vegas|GameWorks|-115.1788768|36.0682585154|89119|nick was pretty much the best part exports Robby got my game set up so fast I played drunk Mario kart and had the time of my life thank god this place exist
730|n7V4cD-KqqE3OXk0irJTyA|bdq3loqMXZrxYAZvHejHHA|_BzYlXWInGT3ouIvIWqYfQ|Las Vegas|GameWorks|-115.1788768|36.0682585154|89119|We stepped into game works looking for something fun to do.  We arrived with a couple friends we hadn't seen in a while and sat at the bar with Kareem.  He is an excellent bartender and has an awesome personality.  He gave us some tips on how to get the most out of our dollar for game play. We got an hour of play each and had an awesome night.  Now we actually come in just to see Kareem.
731|n7V4cD-KqqE3OXk0irJTyA|crjtRBK7bZh6Xqd1lXbMzA|pAZYMMSUAVnjo2pP4SL8Bw|Las Vegas|GameWorks|-115.1788768|36.0682585154|89119|Have to say, my son didn't have the greatest birthday party here, HOWEVER, after contacting the company they ensured everything was made right. After seeing what they will do for their customers, I will be a Gameworker for life!
732|n7V4cD-KqqE3OXk0irJTyA|TeFchCcw8eK-SfKeeceFHA|YoijcOhj_nrO0BE1_AFFuw|Las Vegas|GameWorks|-115.1788768|36.0682585154|89119|Ordered a pepperoni and a meathead pizza. Server Sahara was awesome and very attentive. Food was average and as expected.  Great place for the kids to play and have fun when it gets hot out. Better than chuck e cheese by far. One draw back is that there are quite a few games that aren't working which is a bummer when it's the only one but there were several others that were playable.
733|n7V4cD-KqqE3OXk0irJTyA|xqYXiEXMeqmIqfNH5Z2C8A|C2C0GPKvzWWnP57Os9eQ0w|Las Vegas|GameWorks|-115.1788768|36.0682585154|89119|Great place for kid's parties. I recently attended one, where the family rented out a large room that had plenty of space for guests and tables full of pizza, wings, Philly cheesesteak egg rolls, and bruchetta. The food wasn't anything special, but that's to be expected from a place that focuses on games and entertainment. The employees working the party were friendly and attentive, regularly making sure food and drinks were restocked. The kids at the party were given cards that entitled them to 2 hours of game play on almost all games. Even on a Friday night there were plenty of games available with little to no wait times.
734|n7V4cD-KqqE3OXk0irJTyA|21K9FKBiWSWUFp8sQfEJ3g|EPGxF6J8XZvBtjWRfLmBsQ|Las Vegas|GameWorks|-115.1788768|36.0682585154|89119|I had time to check this place out last night.  The four of us had dinner there and then enjoyed some games.The service at dinner was great.  The server acknowledged they had only been open for about three weeks, and they were continuing to take any feedback to improve the experience.  The shareable crab cake was delicious, but the portion needs to be shipped off!  If you get it,  don't feel ashamed to be a bit greedy as the $14 cake is just that, one expensive cake!  HOWEVER,  the chicken nachos!  You can't go wrong!   The entrees were interesting.  I got the beef rib dish.  It's not something usual for me, but I took the server's advice (he was a good guy).  I found the meat to be a bit fatty.  I found enough tasty pieces to satisfy...  The most unsettling part of the dish was the way the meal was garnished.  Imagine the sword in the stone...  But it was the rib-bone jammed into the pile of wasabi mashed potatoes.  Different.The beer selection was ok...  Just too expensive (I understand the place is on the strip).  I think I could have walked across the way to a competing place, and it would have been more affordable.The game variety was fun (I stink at video games) ,and I enjoyed pinball.  The pacman air hockey will either make you pull a muscle or lose an eye!  It is not to be missed!  After speaking to a few staff members, it's clear they are working to adjust things.  I'll give them a few weeks and will try them again.  Be patient!  I think the place will compete for your attention soon!  Huge TV and video walls will be sure have your favorite sports games available. Oh yeah, there is bowling and computer games there too (not sure what those are all about).
735|n7V4cD-KqqE3OXk0irJTyA|lKXLHriG7pvc3PET-xlaXw|Y6XXYVUx30lWn8AQ_CwdaA|Las Vegas|GameWorks|-115.1788768|36.0682585154|89119|"First off I'd like to thank the kid Nick at game work who helped me out with my misplaced order of pizza that was given away to some other kid in the internet cafe. The manager Joseph totally blew me off when I tried to talk to him. At least act like your listening instead of just saying ""uh, huh. We got you"" . By the way I did not know that he was the manager until after my order was fixed.     . I tried to tell Joseph which computer My brother, son and I was sitting.  We waited about 30 mins for a personal size looking pizza.  Nick came and check on us 2 times as he always makes his rounds around the cafe every time I've visted.  Finally I asked for his help which he got done faster than Joseph has. Nick completely took care of my brother and son after. But he is just a great up beat worker overall every time we have gone into game works he has been helpful and always checking on the kids. Great and attentive.  Joseph it was nice giving me the reason why things weren't done. BUT NICK GOT THEM DONE FOR US. As well as the other 2 employees that was with him."
736|n7V4cD-KqqE3OXk0irJTyA|d7N_5yLneyUUZ9cVECOQdw|fRejGg7Hmt8Potz8bL13_A|Las Vegas|GameWorks|-115.1788768|36.0682585154|89119|Jonathan mahr is the baddest dude on the planet! Figuring out this intricate system of gaming would have been an absolute impossibility without him!
737|n7V4cD-KqqE3OXk0irJTyA|KrPGng5MenURSFNw6DQdGA|i8K5q5r6U6LsOZd2Bs42Xw|Las Vegas|GameWorks|-115.1788768|36.0682585154|89119|The Dine & Play for $14.99 includes 1 entree (there are a few to choose from) and 1 hour of arcade game play. It's a great deal. We ordered 2 of these Dine & Play - which was enough to feed myself and the 2 boys. Pizza was limp, crust not cooked well enough. Blah.Nachos topped with steak is pretty good!The boys played arcade for an hour, while I headed to the Bowling room and sat at the bar. The hour seemed to go by pretty fast with a couple of beers.
738|n7V4cD-KqqE3OXk0irJTyA|o-RerEyNu4M3aBcuA5jsDQ|2bePwIFOZlNHHUXFzrs-bg|Las Vegas|GameWorks|-115.1788768|36.0682585154|89119|It's basically a smaller version of Dave & Busters. It comes with a bar and a small dining area. Food: The food there is okay. Pricing is alright for the portions you get. I wouldn't eat here again. I would just grab food somewhere in the plaza. Location: Great area, located right next to the movie theater. You get the best of both worlds. Teenagers, kids and adults can all enjoy a movie then come here afterwards. Games: Variety of games to play. From winning tickets or just playing multiplayer. Most of the games are up to date and new. They still have some of your old school arcade games as well. A small bowling alley is located inside and a cool ride inside as well that is extra money. They even have one of those motion rides where you can seat yourself.Overall, not too bad but still feels like they are missing something.
739|n7V4cD-KqqE3OXk0irJTyA|ICWf7ABllbuaXzba5BDeEg|TV4abrknx0_Eidaxh-vXpg|Las Vegas|GameWorks|-115.1788768|36.0682585154|89119|I want to give a shout out to Ron the Mgr and his team at GAMEWORKS for the most excellent time we had at their establishment. Hawaiian Airlines recently had our holiday party held there on Jan 21st and it was the best party EVER!!! Ron made sure the party went on with no worries and no problems. Lets not forget their delicious food we ate Pizzas cheese and Meathead pizza's, kids favorite sliders, calamari, chicken tenders, chicken wings, and their chicken cobb salad and caesar salad was a hit with everyone. Our families enjoyed themselves and we definitely recommend any company or families who are looking for a place to hold their events at. This is the guy to see Mgr Ron Arenas at Gameworks at the Town Centre Mall
740|n7V4cD-KqqE3OXk0irJTyA|UgykRR1LWOPkLcu2zfFRgA|Yyxvs759PN4nD1OXrefrQg|Las Vegas|GameWorks|-115.1788768|36.0682585154|89119|Me and my family had a great time in Gameworks located at the heart of Town Square mall. The service was phenomenal. My waitress, Taylor, was very attentive with our needs like refills, napkins, extra such and such. I appreciate it so much since even though they were so busy, they manage to take care of us in a superb level. The food was phenomenal. They have really good selection on their finger foods. Porky Joe's and Carnival Chicken sandwich was to die for. With some yukon fries topped with blue cheese crumbles and bacon was definitely a treat. I would also like thank the manager, Ron. He came to our table to check and ensure that we have been highly taken care of.  It was really welcoming here. I will surely come back for more.
741|n7V4cD-KqqE3OXk0irJTyA|hg956Psr3I_wdqJnqPvm-Q|WJU6ErZ9y6WczmalaDi9HQ|Las Vegas|GameWorks|-115.1788768|36.0682585154|89119|We had our company party here and it was a success! Everyone Seemed to enjoy themselves, especially the children. Just want to give a shout out to Ron Arenas, Manager for all your help with our function and his crew! Awesome job!
742|n7V4cD-KqqE3OXk0irJTyA|mq-yOlPtvUEK115zw2W_5g|XszsZOTE72wHCLcebcpeyQ|Las Vegas|GameWorks|-115.1788768|36.0682585154|89119|Okay, so it may not be that big and it's not what most of us had expected but they had to use the space they were given. I have heard they are expanding and since I've been back, they had added several more games along with fixing the broken games. Although they may not have had what I expected, I'm still happy with going to Gameworks and playing their games.The service is pretty good except I did find it annoying when the barista in the bowling area would rather be texting on her phone or flirting with the one guy behind the bar than serving other customers. I had to ask the bowling attendants to get my drink. I understand it's slow, but it would be nice if someone looked up occasionally. But the rest of the staff are very nice and helpful.
743|n7V4cD-KqqE3OXk0irJTyA|r7sbxrOLqNqGrB5tU2MikA|djb61X-vkg5PF16qM_wI5Q|Las Vegas|GameWorks|-115.1788768|36.0682585154|89119|This is a great place for kids of all ages to play a wide variety of arcade games, ranging from high-end video games (sit inside of a capsule, with wrap-around screens) right down to those silly games you find at other venues that spit out paper tickets you can redeem for nearly worthless prizes.  Needless to say, there's something here for everyone, including even gaming consoles!If you're there over mealtime, there's also a bar and a full-service restaurant within the facility.  We didn't partake at the bar, so I'll leave that for others to review.  The food was average at best, and the although the hostess and waitstaff were friendly, it was very clear that none of them were enthusiastic about being there.  Even with a lot of open tables, it took over 30 minutes to seat our party, and when they did, the tables were cleared but still dirty.  It appeared everyone wanted to be working somewhere else, or not at all.  This strikes me as odd since GameWorks is located in Town Square and is essentially surrounded by other dining options.  With average food and below average staff, and access to a big variety of food within just a few minutes walking distance, it seems GameWorks might want to stick to its primary purpose and make better use of the space by putting in a small snack bar, and using the rest of the floor space for more games.I'll definitely go back with my son to play more games, but we won't eat there again.  No point paying the price for decent food but being served mediocre food when there are so many other options right there.  So go to game, not to eat.
744|n7V4cD-KqqE3OXk0irJTyA|8Jd5ndR_vnz-9IANwx3TYA|Kp5KHBSmV-Htc9NeSjJfPA|Las Vegas|GameWorks|-115.1788768|36.0682585154|89119|Sure, I like video games & especially the nostalgia invoked of playing Pac-Man, etc. in the 80s. My hands don't move that fast now but it's still fun! You have to remember that this is a place for the kiddos so it will be crazy/loud etc. If that gets to be too much, they do have adult beverages. In case you haven't been to an arcade since the 80s, they now have cards onto which they load 30, 60 minutes etc. of play time. So you can leave the quarters at home! I've been here a few times for various events, and for my birthday last year after they sent me a deal for free gaming for up to 6 people for 30 minutes and a birthday treat from the restaurant for me! That worked out as I had visitors in town who were up for some free video gaming. I'm a skee ball fan and also prefer the racing games (of which they have a few here) and so that was an enjoyable birthday stop!
745|n7V4cD-KqqE3OXk0irJTyA|gOupPP5xrAZbRSj-mh5ybA|VBbXGIthY1fRSrgjggGcnA|Las Vegas|GameWorks|-115.1788768|36.0682585154|89119|Love this place. Plenty of games. Not too crowded. But 5 stars are earned for customer service. My son left his iPad there. Not only was it turned in, but the manager delivered it to our hotel.
746|n7V4cD-KqqE3OXk0irJTyA|vaZLbSgql62w0AlDqsayWg|wC_kBm2bzqDAjONNopguFQ|Las Vegas|GameWorks|-115.1788768|36.0682585154|89119|I never tried the food at Gameworks, so I wrote a review about the games. The arcade is very fun for kids aged 3-8. I ended up wasting 20 bucks playing low quality and overrated games for little kids. I was more interested into the eSports games, which is near the back of Gameworks. eSports interests Pre-Teens and up. eSports has a Wii U for Smash Bros and Mario Kart 8, XBox for Mortal Kombat X and Minecraft, PS4 for Call of Duty or Counter Strike Global Offensive, and a computer that can download any playable game for free. It's very cheap for 1 hour, 5 bucks. I look forward to playing MK8 and SSB4.r
747|n7V4cD-KqqE3OXk0irJTyA|XhsH-yk7jBneRYvUDJZCRw|ryCOvuEBv89NxHk5YsMDjg|Las Vegas|GameWorks|-115.1788768|36.0682585154|89119|"Review of the New GameWorks Las Vegas by Mother of three boys.I signed up online for GameWorks rewards program a week before we left on our trip and received a free $10 game play in my email inbox (sweet)My first impression of the new town square location was that the shopping center had plenty of parking and high end shops and out door play spaces for kids.Inside the Facility seems much cleaner, and brighter than the old basement style location on the strip, that we had visited for years prior to it closing. This location seems much less busy right at the opening versus in the afternoon hours on the weekends.The Party/Restaurant area:We had drove from out of state to celebrated my oldest' s birthday here. Birthday parties have many options like: dedicated packages with your own room or u can reserve a table in the restaurant area. We chose a table and added balloons, Andre was our server. I remember this because he was just so friendly and attentive! I felt like we were his only party.. Which we were not! There was two other large groups having parties the same time. It was not bad thou.There is no dedicated ""kids menu"". However we found the Pizza and GameWorks nachos are large enough for kids to share or for an adult as a meal. (The steak on the nachos was very tender and was flavorful.) Each of these seemed kid friendly and were a part of the Play and Eat combo menu (so you could have opted to get a 1 hour timed game card for about $2.99 more if you were coming outside a party package- plus $2 card activation if it's your first time getting a card). However the other menu items are mostly adult game day kind of foods or high end restaurant type meals, that would be great for a night watching sports/ or a girls night out. Not a lot of options small kids ( like hotdogs, mac and cheese etc.) I am usually an avid ""Yelper"" and had been slightly concerned prior to our arrival, about food quality and service, due to some older reviewers. My mind was quickly changed! I had to talk with the chef in advance of ordering because of food allergies and he was very professional and reassuring.  He said they had a new menu starting presidents day with several new items ( like mac and cheese balls), and that the kitchen had changed a lot since opening ( which happens a lot now that I think about restaurants I frequent). He was right that things must have changed, because the quality far exceeded the reviews I had read. I had no problem getting food everyone could eat (despite allergies) and Andre refilled my drink 4 times in the 40 mins. we sat to eat.       Inside the Arcade:Family friendly atmosphere; Plenty of room for our stroller. We even saw a few double strollers while we were there! The family bathroom has a koala changing station. However no place within this bathroom to toss a dirty diaper, other than the tiny hand towel basket? (Hopefully they invest in a solution in the future)For kids of all ages; The game floor seems to consist of several ""zones"": Many large ride on/in games, A row of bloody shoot up games , Massive flashy ticket games, A ""eSports"" LAN room which is quiet, dark and filled with a gamers wildest dreams worth of P.Cs and gaming systems, and lastly the bowling ally ( which I will go into more detail on later).GameWorks did not disappoint with more than enough things to keep everyone entertained for five amazing hours that just flew by.We had so much fun on the floor with timed cards we returned on the 15th for a second day, to allow for time in the eSports room for my older boys.eSports/ Bowling Alley:I inquired about the package options here as well for his party next year, and decided that's what we will plan for, for next time because of the value and option of pc based games like Minecraft. While here they spent 2 hours playing diablo 3 and mine craft.Overall all boys had to be dragged out in the end they were having such a good time, look forward to many visits in years to come!"
748|n7V4cD-KqqE3OXk0irJTyA|mMBBFmKqwkWoPgimnk7lBw|C7I90x_-d_OlyGgVpLKcnQ|Las Vegas|GameWorks|-115.1788768|36.0682585154|89119|"I'm only giving this place a 3 because the selection of games has significantly decreased since it's movement from the Las Vegas strip. I still however love the environment. It reminds me more of a ""Dave and Buster's"" establishment with a bar and restaurant available right inside. You're able to reserve for parties which makes it perfect for groups and birthdays. If you're a hard core gamer this might not be the arcade for you since the selection of games is limited. But if your just here for fun family and games it'll be experience for you and whomever you want to bring. Service is really top notch as always.So make sure to enjoy your time here : )My review is more for the arcade portion of this establishment.everything else gets a 4 star rating."
749|n7V4cD-KqqE3OXk0irJTyA|CTtD8-JV3OphHnq82luSBQ|rxJdZR_3p91B4byPxGqPgg|Las Vegas|GameWorks|-115.1788768|36.0682585154|89119|My friend and I went here to do the purikura. It was pretty cheap compared to HI. Also, the bowling alley was really fun.
