|business_id|review_id|user_id|city|name|longitude|latitude|postal_code|text
0|PfOCPjBrlQAnz__NXj9h_w|rnvu74aNIPn93Z9Ue11Epw|bgtr7jOlALe8ay4g7pnf4A|Cuyahoga Falls|Brick House Tavern + Tap|-81.4756898|41.1195346|44221|I've always enjoyed my time at brick house food and cocktails never disappoint! Its perfect for after work in the summer time. The staff is always polite and the decore is beautiful, a must place to be!
1|PfOCPjBrlQAnz__NXj9h_w|fCCL0pAgYGccUs8shHHIUA|PixAmdRa58XZ3hr8YLS36g|Cuyahoga Falls|Brick House Tavern + Tap|-81.4756898|41.1195346|44221|"I am updating my review to 5-stars because I think for this type of restaurant, Brick House Tavern + Tap is as good as it gets!I live fairly close to Brick House and typically dine here at least a few times a month. I have been here on dates, with large groups, with clients and with friends. I always enjoy what I order and out of all of my visits I have never, ever had a bad meal or inadequate service. In fact it has always been quite the opposite. The servers have always been attentive and the general manager nearly always stops by to make sure everything is satisfactory. On my most recent visit I had a longer than normal conversation with him and he seems like he is a genuinely nice guy who takes pride in his restaurant and truly cares about the experience his patrons receive.I have only been going to Brick House for a couple of years and am always surprised when I mention it to people and they think it is another ""breastaurant,"" akin to Hooters or Tilted Kilt. At least for the couple years I have been going, this is no longer the case. The servers all wear shirts that are not overly low-cut and that go all the way down to their pants without a bare midriff. I do think the servers are collectively younger than than a lot of restaurants but they have always been friendly, show enthusiasm for the menu and do a great job!The décor of Brick House Tavern + Tap is very unique. They have many normal booths and tables but also have a few tables with couches as the seats on either side. They have a few large recliners with table inserts that you can sit at that are positioned in front of large TVs. There are easily 50 TVs around the whole dining area that are positioned in a way where you can see many different ones from wherever you sit. However it also seems that they are not too intrusive and allow one to easily ignore them and focus on who they are dining with. In the winter I often try to get a table near their large open fireplace in the center of the dining room! They also have a large patio with multiple TVs and fireplaces on it.I think their food is pretty unique as well. They have some really good appetizers that are plenty large enough to share. Their dinner portions provide plenty of food to where I often find myself bringing part of it home with me. Everything seems to be priced very reasonably too.If you have yet to try Brick House Tavern + Tap I recommend that you add it to your list. If you visited back when it was filled with scantily clad servers maybe visit again now to see the differences. Overall I think it is a fun restaurant with many menu options that should satisfy anyone wanting to eat!"
2|PfOCPjBrlQAnz__NXj9h_w|-VOh0NNnIo1r24hjwSZL4Q|Hly0NEWXMxbuXa2zm_NJOQ|Cuyahoga Falls|Brick House Tavern + Tap|-81.4756898|41.1195346|44221|I enjoyed this place.  I went the night the Buckeyes beat the Ducks.  The wings where great - fried crispy.  I tried the caveman and BBQ sauces.  I like the caveman sauce - flavor and kick.  I also have the meatloaf.  It was moist and comes with a mushroom gravy.  You can sample the draft beers.  TVs everywhere!!
3|PfOCPjBrlQAnz__NXj9h_w|-2DEY5my1zyafrArLJF2cA|nNpkJm7bzaw0NN-UpNzMsw|Cuyahoga Falls|Brick House Tavern + Tap|-81.4756898|41.1195346|44221|Never had to pee so bad in my life. Here's my story...Brick House is airy and rustic inside with a wood burning fire pit. We came at lunch and it was not busy. All of us opted for iced tea and we had a round on the table within seconds. The house salads were fresh and crispy...honey mustard dressing a bit sweet for my tastes. With just 2/3rds of a glass of iced tea our server asked if we wanted refills...we brushed him off and kept talking. I ordered the blackened mahi sandwich with fries. My colleagues both had the daily special chicken pot pie. As we waited another full round of iced tea arrived. We muttered our acceptances. The mahi was especially juicy and flavorful. In fact I hadn't had such a good piece of fish in this area. The pot pies were flaky and large, nearly 8 inches across with chunks of chicken breast, potatoes and carrots...this was savory goodness. Another round of iced teas arrived and I finally yielded, excusing myself to the restroom. The fries are seasoned well and plentiful...I felt like we got our monies worth for such a decent fish sandwich. As we prepared to pay the check, yet another round of iced teas arrives....this time in to-go cups! Good god man, apparently they need to get rid of this batch of iced tea!! LolOverall very tasty dishes with good service...will come again and perhaps drink beer next time.
4|PfOCPjBrlQAnz__NXj9h_w|5sYAdh5LR355aVGC2b1SAQ|96s7M_uk_Blow-N5_j6ymQ|Cuyahoga Falls|Brick House Tavern + Tap|-81.4756898|41.1195346|44221|"This Brick house has gone Family Friendly and the waitresses are dressed like  every other restaurant's waitresses now.  So to the reveiwer who found the sight of the waitresses legs ""gross and disgusting"", it's safe to come back now.    Anyway, the strength of this restaurant is its wide open setup that makes it an excellent place to catch a game.  The large square bar includes a number of craft beers.  As for the food, mine has been mostly mediocre.  The burger was overcooked and the fries ordinary.  Fish was pretty good.  I go back occasionally, especially on game nights."
5|PfOCPjBrlQAnz__NXj9h_w|_oUHvzxomKT4tS4EvbJDoQ|CB0oWs49o7b8kvvXvx9eJw|Cuyahoga Falls|Brick House Tavern + Tap|-81.4756898|41.1195346|44221|Previously, I have gotten the grilled cheese w/ tomato soup and the chicken pot pie (Wednesday special) the soup that came with the grilled cheese tasted like someone poured marinara in a bowl. Not good. The grilled cheese was ok. The pot pie was amazing. I would order that again for sure. Tonight we both got the lamb burgers. They say they have goat cheese on them, but neither of us had any cheese. We informed the waiter who said they actually come with a goat cheese sauce. The menu clearly states goat cheese, not sauce. The deviled eggs were good the first couple times we came, but tonight the filling was really watery and the whites were very rubbery. I'm really disappointed that the quality keeps going down.
6|PfOCPjBrlQAnz__NXj9h_w|0xKMIkhPVYCSPDA6afn0aw|ajvbqTp1QbKo4pqZmVanYg|Cuyahoga Falls|Brick House Tavern + Tap|-81.4756898|41.1195346|44221|This place is AMAZING!! We found it by chance and are we glad we did. When you are there ask if Lindsey is working. She was our server and was outstanding. Started with the Potato chips with blue cheese and they were fabulous!  We had the Southern Fried Chicken sandwich, Chicken Fried Benedict, Prosciutto wrapped Meatloaf.  There was NOTHING we could say that would deter anyone from giving this place a try. Too bad this is the only one within a reasonable distance.... Can't wait to go back....
7|PfOCPjBrlQAnz__NXj9h_w|IdORJeW38cnSQ1uQ8BetAA|Yi5KGA-QvolRWNeDfzEKrw|Cuyahoga Falls|Brick House Tavern + Tap|-81.4756898|41.1195346|44221|Friday visit to celebrate a friend's 50th birthday. Talked about glory days over beer and burgers with a few pals. Calamari and zucchini fried appetizers were crispy and not overly greasy. Enjoyed the jalapeño and cherry peppers accompanying the calamari. Three of four folks got burgers and one person opted for the wild mushroom pizza. We killed two beer bongs of Thirsty Dog Old Leghumper's porter goodness. My burger was tasty but overdone. Medium rare order was cooked well into medium. Tater tots were a great side. Service was pleasant and attentive. Can't give 4 stars when burgers get overdone. Nice place, good servers and overlooked burgers.
8|PfOCPjBrlQAnz__NXj9h_w|KJYIw6QusaV5zjkHoCcgBg|Q3gesdBVLZHBn1ww-0a1Kw|Cuyahoga Falls|Brick House Tavern + Tap|-81.4756898|41.1195346|44221|Not your average menu, which keeps us coming back. Comfy couches and seats at the bar with lots of t.v.s to watch every game. Not a bad seat in he place. Consistently good food. Highly recommend the Kobe pizza, the garlic tots, meatballs, and the black rum bbq wings. Very good desserts. Bartenders here make great mixed drinks, too.
9|PfOCPjBrlQAnz__NXj9h_w|OBUuKLUM2rF90gpRHGro3A|-_vQjMAn8ooClV02BExR5A|Cuyahoga Falls|Brick House Tavern + Tap|-81.4756898|41.1195346|44221|"I stopped into the Brick House this evening for a beer and for a dinner and was slightly let down.  I've had multiple trips to this place and their saving grace is that the bartenders and wait staff is usually extremely pleasant.  Tonight they were very inattentive and seemed to ignore me for the most part.  There were some ride and obnoxious people at the bar that took a lot of their attention and a motorcycle gang called ""Switchblade Club"" that occupied the outside area.  The kitchen was slow at turning things around.  Also I was sad to learn that the were it of the daily special which was the chicken pot pie.I will go back to this place but am in no hurry."
10|PfOCPjBrlQAnz__NXj9h_w|zorTHqYr_rxVLYgKmlvA6w|m0XvqE6XZgqtNulippuVvw|Cuyahoga Falls|Brick House Tavern + Tap|-81.4756898|41.1195346|44221|One of my favorite  places to eat! Brunch is wonderful. BISON pizza is wonderful. Beer selection  is amazing.  Service  great.
11|PfOCPjBrlQAnz__NXj9h_w|sa6lbcuzaMkjVegOT21t8Q|sXK_eyLpGrNBIAq9fIRGSg|Cuyahoga Falls|Brick House Tavern + Tap|-81.4756898|41.1195346|44221|Been going here for years and it's still my favorite place. The servers are friendly and the atmosphere is perfect for any occasion!
12|PfOCPjBrlQAnz__NXj9h_w|9HPRciMKI0QOVeMtQQs56w|OQ_iIzW0c8PoGUcmEr_V7g|Cuyahoga Falls|Brick House Tavern + Tap|-81.4756898|41.1195346|44221|I came here with my brother and the atmosphere was very nice. He got the ribs and I got the mahi and both came out with nice presentation and flavor. This is probably the best/most relaxing sports bar in that area of town.
13|PfOCPjBrlQAnz__NXj9h_w|ZflgoahrEd1_H0tWSATjQw|KgQnRvsPSrJJTOCp-reYZA|Cuyahoga Falls|Brick House Tavern + Tap|-81.4756898|41.1195346|44221|Eating on couches or lounging in comfy recliners....uh yea thats totally awesome. Tons of TVs with lots of sports...a roaring fireplaces inside and outside...five stars for ambiance. We came here when they first opened and werent impressed...now a few years later, I am a fan. They offer brunch on the weekends with two buck mimosas. The variety is great...def a meat based menu which is perfect for my carnivorous boys. I had the duck hash...I just plain heart duck. My over easy eggs were a little overdone. My son got the special the consisted of pork cop, rib and wings....he loves the sauces and the pork chop was cooked well and not over done. Service is prompt, friendly and efficient. This maybe our new fav brunch spot.
14|PfOCPjBrlQAnz__NXj9h_w|_YxW4INKVxFE07F6rUo4nw|PF29j5TUkdf_SGReIzsH5A|Cuyahoga Falls|Brick House Tavern + Tap|-81.4756898|41.1195346|44221|I came here on a Friday night to watch the Indians play the Cubs in the World Series. I was pleasantly surprised at the fireplace and couch seating that you don't typically see at similar restaurants.The food was tasty and the service was great. The pretzel appetizer and Philly cheesesteak sandwich were both yummy! Great place to grab a quality meal and watch a sporting event!
15|PfOCPjBrlQAnz__NXj9h_w|5pbMWrMrfmveTXb-oyTHQg|3GUhR_XHKsiCYXOZbiH9kg|Cuyahoga Falls|Brick House Tavern + Tap|-81.4756898|41.1195346|44221|They have great food and awesome prices during happy hour. I have been here for both lunch and dinner and it's always been busy. I really like their smoked salmon appetizer and the wings are great too.
16|PfOCPjBrlQAnz__NXj9h_w|jxuLJfCcwUanuMMH5PwtVw|fBXATJ7bPhHzTRcI6xwoIQ|Cuyahoga Falls|Brick House Tavern + Tap|-81.4756898|41.1195346|44221|Nice place to watch the games. It provides for a relaxing atmosphere with good food. Kind of a more upscale sports bar. The staff is friendly. They also hire hot chicks with skimpy clothes to wait on you.
17|PfOCPjBrlQAnz__NXj9h_w|QWb3ldCZeaifSsaieBfVxg|AxMfOSobMQrbdRmSscuK_g|Cuyahoga Falls|Brick House Tavern + Tap|-81.4756898|41.1195346|44221|Pleasantly surprised!  I came for the beer (decent selection, not great), but I was more impressed with the food. I had the Yard Bird sandwich and it was delicious. Place was not crowded (at lunchtime) so I'm wondering where everyone is at?  I would definitely recommend it and I'll be back.
18|PfOCPjBrlQAnz__NXj9h_w|F0SsxwV6oa7urzlBrC9fOg|7X-ks1zJeurJlE53LqipMA|Cuyahoga Falls|Brick House Tavern + Tap|-81.4756898|41.1195346|44221|Myself, sister and her boyfriend came here for a quick early dinner. I have it broken down from atmosphere, service and food quality.The atmosphere was really chill and relax. Not only do you have a choice of table, booth but also a couch booth(which we opted for). They have fireplaces going and you're welcomed by the amazing smell of grilled foods. Also they have areas with couches and tv (perfect for you game night folks). The service was spectacular and our waitress Savannah was extremely attentive! She was friendly, quick and intuitive to our next need (filling up waters, condiments and etc).Finally the food was above bar food but not gourmet quality, atleast for my plate. I ordered a bison burger medium rare and I was really disappointed by how over cooked it was. It was pretty much well done, which over all kills the natural flavor. (Pictures attached).The deviled eggs were amazing but too salty, they sprinkle with sea salt and I would recommend going it and maybe drizzling a little syrup or honey to counter act the saltiness of the bacon in the deviled eggs.One of us got the duck wings and he was floored by the quality of the sauce and the Sriracha ranch was INCREDIBLE! We had to ask for more of it to dip in and for myself to cover the over cooked texture of the bison. My sister loved her BBQ bacon burger and said it was amazing.I'm giving it a 4 because I believe maybe my bison was just perhaps an off moment in the kitchen. It's obvious the skill in the cooking from the other plates at our table and the atmosphere makes it all worth the visit.
19|PfOCPjBrlQAnz__NXj9h_w|BRHnn4cqgGfMfZXOpcqZHQ|66QfAmEfQn6PYntFDtGadw|Cuyahoga Falls|Brick House Tavern + Tap|-81.4756898|41.1195346|44221|everyone was so friendly and the drinks were good food was amazing and it's so comfy they actually have couches you can sit in the BBQ duck pizza was amazing
20|PfOCPjBrlQAnz__NXj9h_w|QyForzRygHhPsHY2b174mg|EAfLAFYv46w2SCvgN_m_VQ|Cuyahoga Falls|Brick House Tavern + Tap|-81.4756898|41.1195346|44221|Good beer and even better food. Staff is attentive. They generally bring food out quickly. Last time I had pub pretzels which were AWESOME. Came with three sauces. Can't beat that!
21|PfOCPjBrlQAnz__NXj9h_w|q8pv-lO8c5yYQANHt21lAg|E4eRV_QCQbpNaz_dzoYpTA|Cuyahoga Falls|Brick House Tavern + Tap|-81.4756898|41.1195346|44221|"Came back here after a Yelp! event to have dinner with family. We were not disappointed! Not only that, we ordered WAY too much food and had to take home lots of leftovers. Even though my son was one of the diners. He eats!  See his review here too (Mark B). We had four appetizers to share. We should have stopped there, it would have been enough. However, we each ordered dinner too. All but one were delicious. I thought the fish 'n chips were bland. I love to ""drown"" the fish in malt vinegar, as I did here. Even then, it didn't have enough flavor. Other than that, definitely a place for some non-standard casual fare. The wait staff was over-the-top friendly as well. Very enjoyable evening."
22|PfOCPjBrlQAnz__NXj9h_w|3315v8KRyAByymB1kXHvJw|3LO2sjlWzsSH1ZZbjsIuwQ|Cuyahoga Falls|Brick House Tavern + Tap|-81.4756898|41.1195346|44221|After reading the reviews for this place I decided to give it a chance. I met a friend here for lunch and we were promptly seated. Our waitress was really nice and very attentive... drinks always refilled without having to ask and our order was taken quickly. She even gave us drinks in to-go cups after we paid our bill. Nice touch.As for the food... it's so-so. We had some wings for appetizers, kind of small, not that juicy, nor were they spicy. But they came out fast... my guess is that they're warming them up rather than deep frying them.I ordered the grilled Mahi Mahi. The description said it was cooked in a garlicky butter sauce but I couldn't taste it. It was rather bland. I think I picked a meal that was too healthy... it just lacked flavor.The manager stopped by once to make sure everything was ok. The keyword is 'once'! That's a good thing in my book!! There are too many restaurants where the manager stops by 4 or 5 times interrupting your meal / conversation... once is all you need. Plus this guy looked a little scary but he was really nice.I forgot to ask how my friends lunch tasted, but it looked pretty delicious. I wish I ordered what he had (some kind of burger).Overall it's a nice place, great atmosphere... it's probably a fun place to go watch a Browns or Cavs game, have some drinks (good beer selection). I would recommend it if you're in the area, but I wouldn't go out of my way to go there.
23|PfOCPjBrlQAnz__NXj9h_w|u7ZkzBKgqysr-RabBQAuEA|9hDFwspnyvfvhpzL7D5kqw|Cuyahoga Falls|Brick House Tavern + Tap|-81.4756898|41.1195346|44221|Loved everything about this place! It has a huge, open-concept dining area with a big fireplace and some tables have couches instead of chairs.I liked the variety of food and drinks they offered. We had fantastic deviled eggs for an appetizer. My boyfriend got duck wings that were tossed in this DELICIOUS sauce... LAWD. UGH! I got a bacon BBQ burger which was really great! And my sister got the bison burger. She didn't like it too much... she asked for medium rare and it came out well. She is also never impressed with anyone's food but her own LOL. One thing they do here that I think is clutch for a good restaurant is they make their own sauces with their personal twist. They had a red pepper aoli and cilantro ranch, both of which were bomb af!The waitress (Savannah) and other staff were super friendly and attentive!I really want to try more of their items, so I'll be back for sure!
24|PfOCPjBrlQAnz__NXj9h_w|6XTAKTQHocBZTaVkQ78aRA|qibWrofYwEEmdtwCSt3DCQ|Cuyahoga Falls|Brick House Tavern + Tap|-81.4756898|41.1195346|44221|As a guy the ambiance is exactly what I would want. It was amazing walking in and being seated at a couch instead of a booth. They asked what sport I'd like to watch and turned on the Indians game for us which was awesome. The food we found good but not great. I ordered the pretzel sticks for an appetizer and the waitress kept trying to take it from our table before we were done. The burgers are huge and tasted great to me but my girlfriend ordered hers with items on the side. The burger came how it is normally prepared and had to ask for her sides 4 times before she got them. I'd go again but I'd be more prepared and specific on my orders.
25|PfOCPjBrlQAnz__NXj9h_w|fQR2uXHOOs-hPvdRvwJ-OA|W2Bs1QiCfuOaqpM9zUQUqg|Cuyahoga Falls|Brick House Tavern + Tap|-81.4756898|41.1195346|44221|Never been in the area and decided to stop with some friends. Cool atmosphere, very nice help, food was perfect! Black and bleu burger was very good and recommended. Great stop!
26|PfOCPjBrlQAnz__NXj9h_w|7zePDS0mvF2Z_m9_UTXkEw|dupHFInR4BChUx6HwP1klg|Cuyahoga Falls|Brick House Tavern + Tap|-81.4756898|41.1195346|44221|Best porkchops ever, a great price, and great atmosphere. Friendly, attentive staff.
27|PfOCPjBrlQAnz__NXj9h_w|0earQU3Ot1ByMjI_DZxmdQ|xFSLb_pxXta5G4oaRB1ylQ|Cuyahoga Falls|Brick House Tavern + Tap|-81.4756898|41.1195346|44221|"Was visiting form out of town and stopped here for dinner. I liked the different seating options, and would have opted for the couch dinner tables but I was by myself and thought that was a little excessive for just me, but its great to have the options. I had a blackberry collins while waiting for my food and it was delicious! Very good selection of unique drinks and a huge beer list (part of which updates based on the season). I ordered the potato soup which was homemade with huge chunks of potatoes and the ""Steak and Shrooms"" for dinner. My server was very attentive and responsive. I will definitely recommend this place to others in the area."
28|PfOCPjBrlQAnz__NXj9h_w|_hSQs7vzaz3cO2nuVMZDuA|3OhkexT0E78zylIH426EOg|Cuyahoga Falls|Brick House Tavern + Tap|-81.4756898|41.1195346|44221|This place is great!!! Very relaxing and great for any sporting event! I wish would have come here for at least one browns home game this year but if they keep up the fantastic service, food and drink I will be back for next football season. This is also a great place to just relax with friends. They have an area with couches and t.vs. You can reserve ahead of time. This would be great for a birthday party as well. We will be going back.
29|PfOCPjBrlQAnz__NXj9h_w|SX0vRs-AK9i1Bp85XgHiBQ|2hVZAM7WUWsoexYJhSgCKg|Cuyahoga Falls|Brick House Tavern + Tap|-81.4756898|41.1195346|44221|Has a very comfortable, casual atmosphere - good for date night or dining with kids. Has a very deep craft beer list and some nice craft cocktails. Food was good, I had the Drunken chops with glazed BBQ sauce, wife went with Mahi-mahi. Would have been nice if entrees included side salads and a small bread bowl. That would have been more consistent with price and expectations.
30|PfOCPjBrlQAnz__NXj9h_w|XalNsXQzZ2MQ6-JJ_uKg_w|pyxTJDZIm9Sp3l4m350skg|Cuyahoga Falls|Brick House Tavern + Tap|-81.4756898|41.1195346|44221|Everything was great.  Great atmosphere.  Friendly people.  We had a party of 16 and they were able to accommodate us.  We sat at a booth, but you can also sit at a sofa table or recliners.
31|PfOCPjBrlQAnz__NXj9h_w|CeR1hgMD7uEMZsNr2Gmw6w|HVpUBCKvzx5rjvmDqVaHkg|Cuyahoga Falls|Brick House Tavern + Tap|-81.4756898|41.1195346|44221|My first time here was during a Sunday afternoon. I love the seating arrangement and the atmosphere of the bar. The service was attentive but slow. While the food is great, I ordered the Sunday special pot roast. The rice was hot, the meat was cold. I expected a little more for the cost.
32|PfOCPjBrlQAnz__NXj9h_w|EdesuxetUY9q2LZ0W6RQaQ|Tvj7yYKjt6MUXOvbtW18jw|Cuyahoga Falls|Brick House Tavern + Tap|-81.4756898|41.1195346|44221|Came here for a late brunch on a Sunday . Can't go wrong with a $2 mimosa. Food was good and service was excellent. I had the grilled chicken sandwich and it was delicious and juicy. My boyfriend has the fried chicken Benedict and that was good as well. Overall no complaints and will come back for sure
33|PfOCPjBrlQAnz__NXj9h_w|5o5XSxSEq_BiqoLFT63Qtw|VRvEeVv2NKT-oG_cZB8k-Q|Cuyahoga Falls|Brick House Tavern + Tap|-81.4756898|41.1195346|44221|Food was pretty good.... server was average but attentive... I loved the atmosphere and the set up of this place.  We will be back more than likely!
34|PfOCPjBrlQAnz__NXj9h_w|IL80EXjvXPSbOvslz50YgA|hDSeawZ10uiqU8lZk6knUg|Cuyahoga Falls|Brick House Tavern + Tap|-81.4756898|41.1195346|44221|This was my first visit to a Brick House restaurant. First, the atmosphere is nice. Second, the waitress was attentive and nice. Third, the food was just ok. I've been on a mission to find a place that serves pizza with a nice, crunchy crust. I thought a pizza made in a brick oven might be just the thing, so I ordered their $10 pepperoni pizza. It was just ok.  I'm a retired teacher, and the pizza reminded me of my school's cafeteria pizza.  The pizza was unevenly heated, and the cheese was a little overwhelming. I'll try the Brick House again, just not for the pizza.
35|PfOCPjBrlQAnz__NXj9h_w|Nb-hzSY3AbSvHVhEHP58Qw|jLCc-grOWX0h8nmGD6QXFg|Cuyahoga Falls|Brick House Tavern + Tap|-81.4756898|41.1195346|44221|Good service, nice atmosphere, the filet is horrendous, I thought they brought me a ribeye. The patio is great you can even smoke near the fireplace.
36|PfOCPjBrlQAnz__NXj9h_w|KLM4DbcFzsk4D99HCtCj7g|Yof00mbd6qQaR0GHM3bHOg|Cuyahoga Falls|Brick House Tavern + Tap|-81.4756898|41.1195346|44221|Tried the goat burger special. It's apparently made with goat, lamb and beef on what appears to be a flatbread bun. Burger was burned on both sides and the bun was also charred. Fries were good though. Service was really good tonight.
