|business_id|review_id|user_id|city|name|longitude|latitude|postal_code|text
237|1K4qrnfyzKzGgJPBEcJaNQ|CTpxAwaLzxByp8dL1AiA9w|VK2TcRhK1vboobxmETDm5A|Toronto|Chula Taberna Mexicana|-79.3359022|43.66925620000001|M4M 3A6|Gluten-free review: Went here thinking it's Mexican food so I should have a lot of options. Yeah, not so much. The items on their menu are not labelled with any gluten info so the waiter's suggestions were really helpful. All of the seemingly gluten-free options that are fried, such as tortilla chips and the cornmeal crusted calamari, are contaminated as they are fried in the same vat as the wheat flour fried items. The tortillas for the tacos are made from corn while the burrito ones are made with wheat. About half of the tacos offered are not gluten-free (3 are wheat flour battered), including the chirizo (normally a gluten-free standard) because it is marinated in beer. Noooo! I ended up going with the pollo tacos and they were delicious. For reference, I have a gluten sensitivity and minor cross contamination (few crumbs) doesn't bother me severely. I had no reactions with this place, but I also actively avoided eating the fried items that I knew would be cross contaminated. The reason I'm giving this place 4 stars instead of less for the minimal gluten-free options is because the wait staff are super helpful and try their best to work with your allergies. Also the ambiance of the place is fantastic, especially their back patio, which is a must for summer days. TL ;DR minimal GF options, great ambiance
238|1K4qrnfyzKzGgJPBEcJaNQ|RS4es_XU6tauicFKNbX4fg|v50VFaeMoKhQHA7zR4xQJQ|Toronto|Chula Taberna Mexicana|-79.3359022|43.66925620000001|M4M 3A6|Went to this new Mexican place in the neighbourhood. I think it's a nice bit of diversity. Good choices of tacos and drinks to choose from.
239|1K4qrnfyzKzGgJPBEcJaNQ|rMpQeQiu76-FG0-Zhxr97Q|a5IiFbcKjqAKRoQlcA5bnw|Toronto|Chula Taberna Mexicana|-79.3359022|43.66925620000001|M4M 3A6|"We went here tonight to celebrate my moms birthday. It was a nice night and we had a reservation so we were able to score a seat on the patio. Me and my husband ordered mixed drinks, a margarita and a ""Mexican sunrise"". Both were delicious, came cold and refreshing, the bar tender gave us a solid pour. We decided to order a bunch of different things just to try. We tried: the carnita tacos (3), the zucchini fritters, the chorizo corndogs, the brisket burrito, the shrimp ceviche and the chicken lollipops. There were no complaints  by anyone. Everything was very fresh, service was frequently and efficient. Dishes came out as they were ready (as indicated on the menu). The corndogs are a bit heavy, and fritters my favourite item, was a wee bit oily but nothing you can't get over. I ordered a sangria towards the middle of the meal and I didn't get it until we were almost finished. This meant I had to chug it before we could leave. It would not deter me from coming back however. The patio was quite congested, I think they have one too many chairs out there, but it's a good vibe so again no complaints. The tiki hut on the back patio is so cute, a very nice touch. Overall, a great new addition to the neighbour, any Mexican food lover will not be disappointed."
240|AtdXq_gu9NTE5rx4ct_dGg|kW5U5fpDNpxagNdS9db_eQ|8D8mjeNaJ3DGhl0WX8copA|Toronto|DAVIDsTEA|-79.3807182|43.6567287|M5B 2G9|This location suffers from the same challenges that other David's TEA's face- it is tough for 2-3 employees to manage giving samples, handling dozens of tins, managing the cash, and actually serving tea!If you can get beyond the fact that what takes Starbucks one minute takes three here, you are in for a pleasant surprise.The people who work here are exceptional. The employees and whoever had the foresight to hire them deserve a lot of credit. They are as quick as they can be given all the possibilities, and they are kind.The tea is also great. Occasionally, some teas smell better than they taste (any tea with chocolate is this way for me). However, they definitely have something to suit your taste.Located near Chipotle just north of Yonge-Dundas Square, this location is easy to find.
241|AtdXq_gu9NTE5rx4ct_dGg|ka0QB_XeNbJ6UMAqvXzQMw|65yB0ydGXOZ_-T6J_GbKfw|Toronto|DAVIDsTEA|-79.3807182|43.6567287|M5B 2G9|To start off this store entrance is not on Dundas but rather on Yonge. This is like any typical David's but it does seem wider than some I have been to. I was only there to get a cold tea and I was looking for whatever was ready. They had a strawberry and rhubarb or a black so I went with the black unsweetened. I like the fact that they have it ready as opposed to some Teavana that don't. I usually leave the tea buying to my wife but I like getting some once in a while whether it be a tin or bag. I prefer the black type while my wife likes milk oohlong. They have a deal going on now where if you buy a travel mug you can buy an iced tea for a dollar.The staff here are friendly as as usual no tax on loose tea even the ones they make to go ($3 even).
242|AtdXq_gu9NTE5rx4ct_dGg|4X7y5I1yFYnxjOEe6ab2IQ|TEDr_4Jmq03V5nYh6s9r9w|Toronto|DAVIDsTEA|-79.3807182|43.6567287|M5B 2G9|I passed this place a million times before ever venturing inside. Since my first visit, I was hooked. The staff is incredibly attentive, pleasant and at times it seems like they have memorized every single ingredient of every single tea they offer. The product itself is delicious hot and on ice! I bought one of their pitchers and make my own iced tea daily. It's become a part of my routine. I highly recommend Davids Tea and especially this particular location.
243|AtdXq_gu9NTE5rx4ct_dGg|GohCl2YBrsmqj_HaeKyBRg|tvVduaNaiI8ZwS7d5qESVw|Toronto|DAVIDsTEA|-79.3807182|43.6567287|M5B 2G9|First time at a David's Tea, ironically, it was in Toronto, CAN. I must say it was a good time and experience. There is a whole wall filled with different teas that will float your boat and suit your fancy. I got the Queen of Tart, which tasted as it name says. It was tarty, which is good for my preference. You can always ask them servers to add more sugar depending on your preference.The huge selling point for this location was the wonderful attitude and service the employees provided for us. My friend spilled his drink literally a few seconds after grabbing it off the counter and the employees immediately apologized for our mistake. They did not have to but they even offered to clean the spill for us. My friend got another drink from the employees pretty quickly too. Gotta say I'm a little bias for their service and they were fairly attractive too. Overall, I would come again if I was in Toronto.
244|AtdXq_gu9NTE5rx4ct_dGg|wsDdxK3QWEW9i9-GxVzcqw|d_uSfozaAZR4OpDNa8IiZQ|Toronto|DAVIDsTEA|-79.3807182|43.6567287|M5B 2G9|Best David's tea I have been to! The staff is amazing and patient and they offer samples of their tea and introduce all their great new mixes! They have been the best location! I got the earl garden but they do know their stuff about tea, caffeine levels and what not! This was a black tea based! Plus they do not charge extra for soy unlike Starbucks! I can't wait to try a new tea every time!
245|Dj0S-Oe4ytRJzMGUPgYUkw|C6VZQx2z7fVovly3vLcPkA|Z0UzKrJR2FJ5wtN5HtJKsw|Elyria|Panera Bread|-82.06714000000001|41.343078000000006|44035|This 2000th Panera opened on 3/23/16, but it is already showing its fine heritage by echoing the high quality food and friendly, well-trained staff of previous Panera restaurants. This is a great place to come for quick, delicious food and drinks, but it is also a fun place to meet friends and spend a couple of hours drinking coffee and playing on your computer.
246|gAy4LYpsScrj8POnCW6btQ|tXoasholWkVuJqyTHBVS-Q|pX4gEm0CcWruZVlsjX5eTA|Fort Mill|Toast Cafe|-80.9905588|35.047286799999995|29708|"Ordered the Mushrooms Gruyere Spinach omelet.  Very good,  and they don't skimp on the fillings.  Service was excellent. Coffee was excellent. Tasty red potato ""hash Browns.""  Country atosphere is light and airy. The only negative I can think of is that for me,  it was difficult to get comfortable in their hard wooden chairs.  That aspect alone detracts somewhat from the experience. Advice: get some chair pads or build in some booths."
247|gAy4LYpsScrj8POnCW6btQ|jnT5-2W1TDMXhS1lGG0U0w|htKZZx3XQ2ubwSRedyoM2w|Fort Mill|Toast Cafe|-80.9905588|35.047286799999995|29708|I love coming to grab breakfast here, the food is always delicious and the service is always great. I usually will order their eggs benedict or crabcake egg benedict. Every now and then I'll venture off and do a french toast combo or something. Whatever the case may be the food is never a let down :)
248|gAy4LYpsScrj8POnCW6btQ|b9vS-uYur9FHcXLhaZQfQg|AzOupRXnY88QOavDcR8Xsg|Fort Mill|Toast Cafe|-80.9905588|35.047286799999995|29708|Love this place!!! Been countless times for breakfast, lunch and take out. Wait staff is always friendly and help each other out. I pretty much stick to the California salad with the creamy raspberry dressing so I can't comment fully on the menu or quality of the rest of the food but the other folks I dine with have always been pleased with their meal.
249|gAy4LYpsScrj8POnCW6btQ|PJOP1lXaZZ_3NEIp5kEcnQ|13ZH2KHiPgCQ0aBvb1Q15g|Fort Mill|Toast Cafe|-80.9905588|35.047286799999995|29708|Brunch as amazing! We had the stuffed French toast and three eggs with hash browns. Both were so delicious. Service was great as well. We will definitely be back. :)
250|nbhBRhZtdaZmMMeb2i02pg|ydylyPxEf07AVLMZVX4Dvg|Ri3cu8XTnyA83pyJrzTMvw|Toronto|Sunnyside Grill|-79.49043309999999|43.7818155|M3J 3K5|Great place to eat! I had the bacon burger with egg combo. It was delicious. One of the best burgers i've had. It came with a very generous portion of fries as well. Staff was very friendly and sociable. The restaurant was also very clean. Will definitely return!
251|nbhBRhZtdaZmMMeb2i02pg|rPe7iEdzBsC2JYfvhfgXCA|iJJa3xVPSJcTjbB_GQRQxA|Toronto|Sunnyside Grill|-79.49043309999999|43.7818155|M3J 3K5|This is an amazing place to eat breakfast. As someone that goes every Friday I can say that this place has excellent food and excellent customer service.
252|nbhBRhZtdaZmMMeb2i02pg|7_61l7790iHRMsi8nlX3QA|oP2OWb5GTvFI6rde2ZRYbg|Toronto|Sunnyside Grill|-79.49043309999999|43.7818155|M3J 3K5|You gotta come here for the value and great service! The food is eggsellent and great portions for the price. The owner Angel lives up to her name, she is friendly and the staff is awesome too, highly recommend for a delicious breakfast!
253|1_3nOM7s9WqnJWTNu2-i8Q|jANTf7b6K0oKalK1J2f5Cg|gZNMJ3bx9xNN7VxHxaFESg|Montreal|Le Bistro Balmoral|-73.5667249688|45.506772212600005|H2X 2A1|Arrived late into the city and a group of us decided to eat here. Burgers, salad, chicken, and steak were delicious.  We were seated at a family style wood table with dripping wax candelabras and lights were low so an intimate ambiance. A few of my friends I was with were here before and said the food was still just as delicious as last time. Would go again, maybe for lunch to sit on outdoor patio.
254|1_3nOM7s9WqnJWTNu2-i8Q|hZq7WCp5EJytoVIgHSt-qA|pEzb9RfmnD2zn5wUPpdmzg|Montreal|Le Bistro Balmoral|-73.5667249688|45.506772212600005|H2X 2A1|Joli petit bistro situé au métro place des arts, en face de l'endroit ou jadis se trouvait le spectrum. Le décor est moderne et accueillant, un peu lounge. L'accueil est chaleureux. La vue sur le quartier des spectacles est superbe !Nous ne savons pas trop que prendre, alors nous demandons conseil au serveur, qui ne semble pas trop passionné par quelque chose en particulier. Soit qu'il n'a pas goûté ou bien il n'aime pas. Nous optons pour les calmars frits en entrée, servis avec une mayonnaise maison, qui sont LES MEILLEURS que j'ai eu la chance de manger. Il s'agit de VRAIS morceaux de calmar enrobés d'une légère panure de style tempura. Aucun goût caoutchouteux, j'aime ça !Pour le repas principal, je choisis la bavette. Elle est assez ordinaire, sans saveur et la  pièce n'est pas tellement tendre. Le prix dudit repas est assez dispendieux pour un steak moyen et des calmars. Je ne sais pas si j'y retournerais bien franchement. Probablement pour un 5 a 7, mais pas pour le repas. Ils ont de bons spéciaux après 22h, mais c'est un peu tard pour moi.
255|1_3nOM7s9WqnJWTNu2-i8Q|jESns7f-tTDNuscI8kLMEQ|NrevV_Ku8WCNZC4tyzg7SA|Montreal|Le Bistro Balmoral|-73.5667249688|45.506772212600005|H2X 2A1|I'm surprised to see so many negative reviews for this restaurant.  I have to admit that I live and work in the area, so I tend to stay away from it during prime tourist/jazz festival season since I can enjoy the restaurant at any time of the year.  While I can't comment on their food or service when they're running at full tilt, I would say it's not to be missed in the fall, winter, or even spring.  My experience has always been excellent and although the menu isn't inexpensive, I don't find that it's overly expensive for the quality of food and service that you receive.  Add the fact that it's a non profit and all the proceeds go to funding our amazing Jazz Festival every year, and it's a no brainer choice for a lovely meal in the Quartier des Spectacles.
256|1_3nOM7s9WqnJWTNu2-i8Q|W4LuxTtHjHvE7aLiLAtPdQ|1Ydc4NN2pZOStnViOlLIOg|Montreal|Le Bistro Balmoral|-73.5667249688|45.506772212600005|H2X 2A1|Had a wonderful time here, wife and l on vacation for the F1 race, so the city was abuzz with activity and closed down streets for the many festivals nearby.So because of that, service was a bit slow understandably, our server apologized for that, so no knock there. Prices weren't too overly expensive, as we ordered up a bottle of Moet & Chandon Imperial to go with our fantastic French Onion soup and a cheese plate, salad and a veggie platter. Salad was good as well. Great atmosphere, (we dined al fresco) friendly staff, l recommend this place.
257|1_3nOM7s9WqnJWTNu2-i8Q|PAccjYId1eXto5okkUiRGg|NLX7OC9XpCSzlOBMG_lmeQ|Montreal|Le Bistro Balmoral|-73.5667249688|45.506772212600005|H2X 2A1|Great dinner and service last night. This is a non for profit restaurant that funds things like the Jazz festival. Our drinks, steak, veg burger, fruit cup and cream brule were great before some Just for Laughs weekend shows.
258|FXHfcFVEfI1vVngW2gVOpw|5YFdUHW2xIIGzB80HyGAuw|d_SJYpIBWH3fRTL7eObZCw|Toronto|Bampot House of Tea & Board Games|-79.4088784561|43.661581680699996|M5S 1H6|We went to Bampot on a Friday to meet up, drink some tea, have some snacks and spend endless hours playing obscure board games. Of those things, they hit 2/3. Board games were a ton of fun and the selection was great. We spent about 5.5 hours there and actually made it within 15 minutes of closing at about 1:30am. The tea selection is also pretty extensive; some of the teas are also hand blended/mixed in-house and may take a bit longer to prepare. I had the Bazaar blend (hand mixed) and it was excellent. The right balance of a strong black tea with a unique mixture of spices including saffron that brought a nice twist. The downsides now. While the tea was good, the snacks were just okay. And we tried quite a few of them. Vegetarian curry, peppermint chocolate cake, boterkoek, hummus and salad and bowl of bits and bites (kind of like a trail mix). None of those were great and worth ordering again in my eyes. But it's good to have some snacks while indulging in the tea and games. Another downside was the service - VE-RY SLOW. It's a good thing the board games kept us distracted. Other than that, the seating is comfy and cafe is very Bohemian inspired. I thought it was a nice surprise to find out some of the art work on display can be purchased.Overall, would recommend Bampot for a fun night of board games and great tea!
259|FXHfcFVEfI1vVngW2gVOpw|o69CyrO8ofTVD1qh-Au7Dg|5AKt52TW50eWHk9Ia03uzg|Toronto|Bampot House of Tea & Board Games|-79.4088784561|43.661581680699996|M5S 1H6|Bampot is a very unique Tea shop. It offers a HUGE range of different types of tea and amazing interior. You can also play board games if you wish to, and there are is usually a small selection of food. The main weakness is the service. I have been here twice and both times I had to either wait a long time to be served or go find a server myself. The problem is that you need to grab your own menu (which is fine) but then because of that they don't keep track of who comes in.
260|FXHfcFVEfI1vVngW2gVOpw|79aJ2g4hYqiG54C1Z7jS7w|XXN4zUIY-PVRaeqTc8IaaA|Toronto|Bampot House of Tea & Board Games|-79.4088784561|43.661581680699996|M5S 1H6|This is a Gem in Toronto. Walk in and teleport to a cafe in Morocco, surrounded by calming vibes and aromas. The teas are great here, and many even offer free refills. You also get a large variety of games to play with. It is extremely well priced and the staff is beyond nice. My server explained many of the teas and their origins. Great experience and a must go to for any traveler.
261|FXHfcFVEfI1vVngW2gVOpw|joMRMRgdIhAuymn-pIvXlQ|7_RaCe5zzPBYWm9znlffUA|Toronto|Bampot House of Tea & Board Games|-79.4088784561|43.661581680699996|M5S 1H6|"""Interesting"" is definitely the word I would use to describe Bampot House of Tea & Board Games. If you know me, you would likely notice my clutch word or filler word is ""interesting"". I use the word to describe situations that are different, uncomfortable or fascinating. Often, I use the word when I do not know how to respond or to fill the gap (that may otherwise be a silent void). Bampot House of Tea & Board Games, I would say embodies the word ""interesting"". It is truly where people from different worlds collide. It feels like a mutli-verse - one corner of the room may have people jamming with guitar, the other  corner is filled with people enjoying board games, somewhere in a hidden corner is a person quietly working hard on their project. At times, you may overhear conversations related to overcoming limiting beliefs, provoking spiritual awakening or just waves after waves of laughter.Even the password of the wifi is contemplative - ""maybe there is more to life, maybe not"".The food at Bampot is earnest, poignant and hearty. There is something special about a bowl of hot soup, hearty stew or sincere curry to warm you up from the inside and out on a cold day. My soup of the day, Spicy beet with chickpea soup ($7.50) was full of warmth. It was accompanied by simple toast and coconut butter. Vegetarian rejoice.All the food served at Bampot are vegetarian friendly!There are also endless selections of teas for every flavor profile. Different tea for different peeps! My favourite at Bampot is surprisingly not tea; it is the dark hot chocolate with housemade almond milk. It was the perfect soulful drink with a hint of sweetness. The white pot and cup with silver embossed lace even matches my OOTD (outfit of the day). It must mean we are meant to be! ;) Sitting in a small booth alone at Bampot, surrounded by rustic cushion with a warm bowl of soup and observing life is the wonderful way to spend a quiet evening."
262|FXHfcFVEfI1vVngW2gVOpw|KsuGc7glCao5dTp1-IPmwg|dEDId4Rp2JpblIfYIoH00w|Toronto|Bampot House of Tea & Board Games|-79.4088784561|43.661581680699996|M5S 1H6|When I first heard about Bampot through social media, I knew I had to check it out and bring my boyfriend along. We both love tea and board games so it was the perfect combination. We went to check it out a couple of weeks after it opened. The environment of the cafe definitely suits the name. The cafe is decorated with yellow, orange, and dark red walls, reminding me of the Indian culture. There are some areas where you can sit in the nooks and crannies of the cafe with only pillows and drapes, giving off that bohemian vibe. The space gives a lot of intimacy compared to most places I have been to; which is nice and unique to Bampot. Bampot serves a vast selection of tea, some with free refills. Like most places, it has a $5 sitting fee if you would like to play the board games. However, it only costs $3 if you decide to order food. My boyfriend got the soup of the day, which was some sort of Thai curry soup the owners whipped up. He absolutely loved it and I enjoyed it as well. It had that spicy flavour that curry lovers would be familiar with. I had the Quangzhou Milk Oolong tea, which tasted exactly what you would expect a milk tea would taste like. It wasn't my favourite, but I didn't mind drinking it either. For each pot of tea you receive, you get a timer as well, so you know when the tea is perfectly steeped. Between my boyfriend and I, we pretty much drained all the hot water they had for our free refills haha.There are currently about 160 games available and when I was there, many of them were unopened. My boyfriend was in heaven for a short period of time after I found a brand new Firefly board game towards the end of our stay. Unfortunately it was a two hour game and we were already there for about two to three hours. He sadly had to wave goodbye to it.The cafe hosts different events here and now. They have Scrabble Night on Mondays and free knitting lessons often. They planned on having a Dungeons and Dragons game night as well. The owners said that they were looking for games to host events for. If you are a game enthusiast and would like to bring an event to Bampot, definitely reach out to them!Overall, I highly recommend Bampot. It's so good that it's now my boyfriend's favourite board game place, knocking Snakes and Lattes to his second favourite. This is definitely a great date location to spend with your significant other. Also if you are a tea enthusiast, it is a must to visit! The cafe is very intimate and cozy with such a lovely staff. I don't recommend coming in with a large group of friends unless you are willing to break the group down. It's best to have no more than three (or at most four) other friends with you because of the space. The cafe also has hookah available as well.
263|FXHfcFVEfI1vVngW2gVOpw|FKEH2UVt6V_Q0wYJUwCJuw|5yuDfcovFw3jc0kn3UYgbQ|Toronto|Bampot House of Tea & Board Games|-79.4088784561|43.661581680699996|M5S 1H6|Absolutely the best place in Toronto. I'm so happy that such a unique, comfortable tea place exists! They have something like 80 different teas on the menu, and the cutest little nooks with cushions to lounge on while you hang out and relax. Equally awesome place for a fun get-together or a comfy, quiet study session. Love it so much! :)
264|FXHfcFVEfI1vVngW2gVOpw|KjsEDfn80RM0I-wVoTRZ7w|QlRsVCCytArycuuKSyUBLg|Toronto|Bampot House of Tea & Board Games|-79.4088784561|43.661581680699996|M5S 1H6|This place is so unique and unlike anywhere else I've ever been! The best word that comes to mind is cozy: this place is just so warm and cozy, and would be a great place to chill on a chilly fall or winter day. I came on a Sunday afternoon with a group of 4 other friends around 1 PM - it was pretty quiet when we first came in, but was a lot fuller when we left about 2 hours later. I love the decor in this place, there are so many colours and different pieces (carpets, curtains, tapestries, pillows) and it's so fun and eclectic, this place just has so much character. It is pretty accomodating for groups of various sizes, although I probably wouldn't come with a group larger than 5 or 6. We sat on some couches around a little coffee table, but it looked like most of the other seating areas were meant to fit groups of 2 or 3. I didn't actually look at the board game selection, but my group ended up playing one that I've never heard of before, so that was fun.They have an extensive tea selection - I had the honey spice tea and it was kind of like a chai tea but a little bit sweeter and less cinnamon-y. I also had a salad and added a side of pita and hummus. The pita was so good, it was so thick and soft, and my only complaint here would be that there wasn't more. The salad was also pretty good, it had a lot of stuff in it like cashews and the vinagrette is house-made and very flavourful. Vegetarians will be happy to note that all the food options here are vegetarian and most are also vegan. My meal ended up being $18 after tax.I can definitely see myself coming back here, even if it's just to chill and chat with some friends. I saw lots of small groups nestled in these little nooks all around the place, and some people had even brought knitting supplies with them. It looked so cozy!
265|FXHfcFVEfI1vVngW2gVOpw|-V8o9nRXNjm3bcw1a3XIpQ|6T6WApBOD1Hf6IkdZfgUKA|Toronto|Bampot House of Tea & Board Games|-79.4088784561|43.661581680699996|M5S 1H6|This is my new favourite place in Toronto. It isn't somewhere you go for dinner, although it has very good food. Go here to lounge with friends, play board games, enjoy the casual ambience, and drink amazing tea.
266|FXHfcFVEfI1vVngW2gVOpw|_4Vhn5LAu_nt0UmlC-Bj4g|IwZvkTXf7VQ2Mv6-sdwD4A|Toronto|Bampot House of Tea & Board Games|-79.4088784561|43.661581680699996|M5S 1H6|What a fantastic new teahouse!  I was recently here for a birthday party and instantly fell in love with the place. The owners are young and run the shop themselves. I love the decorations. Especially the little reading nooks. I could spend days here. The specialty teas danced on my tongue. They're pricey, but they're delicious and unique. This is no starbucks.
